{
  "task_id": "P900-T001",
  "verdict": "ACCEPT",
  "summary": "Evaluación sintética del ejercicio Demo.",
  "acceptance_criteria_results": [
    {
      "criterion": "La función devuelve el saludo esperado.",
      "passed": true,
      "evidence": "Comprobación sintética."
    }
  ],
  "findings": [],
  "validation_assessment": "Comprobación ficticia correcta.",
  "documentation_proposals": [],
  "blocking_questions": [],
  "next_prompt": "",
  "executor_selection": null,
  "scope_grants": []
}
