{
  "task_id": "P900-T002",
  "verdict": "REVISE",
  "summary": "Evaluación sintética del ejercicio Demo.",
  "acceptance_criteria_results": [
    {
      "criterion": "La función devuelve el saludo esperado.",
      "passed": false,
      "evidence": "Comprobación sintética."
    }
  ],
  "findings": [
    {
      "severity": "medium",
      "category": "correctness",
      "file": "src/demo.py",
      "line": "2",
      "problem": "Saludo sintético incorrecto.",
      "evidence": "La comprobación ficticia falla.",
      "required_fix": "Devolver el saludo esperado."
    }
  ],
  "validation_assessment": "Comprobación ficticia fallida.",
  "documentation_proposals": [],
  "blocking_questions": [],
  "next_prompt": "Corrige únicamente el saludo sintético.",
  "executor_selection": {
    "model": "claude-sonnet-5-5",
    "effort": "medium",
    "reason": "Ejercicio sintético acotado."
  },
  "scope_grants": []
}
